{
  "title": "Inside a Learning Experience",
  "subtitle": "The components that make learning stick",
  "diagramLayout": "hierarchical",
  "parts": [
    {
      "id": "core",
      "label": "Learning Experience",
      "shortLabel": "LX",
      "icon": "üéØ",
      "isCore": true,
      "detail": {
        "purpose": "The complete journey a learner takes from not-knowing to understanding and application.",
        "howItWorks": "Combines multiple elements in a sequence designed to build understanding progressively.",
        "keyInsight": "Great learning experiences feel effortless - the complexity is hidden from the learner."
      }
    },
    {
      "id": "hook",
      "label": "Hook / Activation",
      "shortLabel": "Hook",
      "icon": "ü™ù",
      "color": "primary",
      "detail": {
        "purpose": "Capture attention and activate prior knowledge before introducing new content.",
        "howItWorks": "Uses questions, surprising facts, or relatable scenarios to create curiosity.",
        "keyInsight": "Without activation, new information has nothing to 'stick' to in memory.",
        "connectedParts": ["core", "content"]
      }
    },
    {
      "id": "content",
      "label": "Content Delivery",
      "shortLabel": "Content",
      "icon": "üì¶",
      "color": "secondary",
      "detail": {
        "purpose": "Present new information in a clear, structured, and engaging way.",
        "howItWorks": "Uses multiple modalities (visual, auditory, text) with careful pacing.",
        "keyInsight": "Less is more - focus on essential concepts, not comprehensive coverage.",
        "connectedParts": ["hook", "practice"]
      }
    },
    {
      "id": "practice",
      "label": "Practice / Application",
      "shortLabel": "Practice",
      "icon": "üéÆ",
      "color": "accent-green",
      "detail": {
        "purpose": "Give learners opportunities to use what they've learned in meaningful ways.",
        "howItWorks": "Includes exercises, scenarios, and problems that require applying concepts.",
        "keyInsight": "Retrieval practice is more effective than re-reading or re-watching.",
        "connectedParts": ["content", "feedback"]
      }
    },
    {
      "id": "feedback",
      "label": "Feedback Loop",
      "shortLabel": "Feedback",
      "icon": "üîÑ",
      "color": "accent-blue",
      "detail": {
        "purpose": "Help learners understand what they got right, wrong, and why.",
        "howItWorks": "Provides immediate, specific feedback that guides improvement.",
        "keyInsight": "Effective feedback explains the 'why' - not just right/wrong.",
        "connectedParts": ["practice", "reflection"]
      }
    },
    {
      "id": "reflection",
      "label": "Reflection / Transfer",
      "shortLabel": "Reflect",
      "icon": "üí≠",
      "detail": {
        "purpose": "Help learners connect new knowledge to their own context and goals.",
        "howItWorks": "Prompts self-reflection and planning for real-world application.",
        "keyInsight": "Learning without reflection is just information - reflection creates transformation.",
        "connectedParts": ["feedback", "core"]
      }
    }
  ],
  "connections": [
    { "from": "core", "to": "hook" },
    { "from": "hook", "to": "content" },
    { "from": "content", "to": "practice" },
    { "from": "practice", "to": "feedback" },
    { "from": "feedback", "to": "reflection" },
    { "from": "reflection", "to": "core", "style": "dashed" }
  ],
  "completionMessage": "You've explored all the components! Notice how they form a cycle - great learning experiences are iterative."
}
